Date,Ingredients
2018-03,"Kumiko, Chicago,Photo:Emma Janzen,March 30, 2018,Weaving coffee into the classic gin & tonic formula, this recipe works well with many types of coffee and gin. “The botanicals of particular gins may highlight notes of various coffees or certain roasts,” Julia Momose says.,Share this recipe:,Fill a glass with ice. Stir to chill the glass, then strain out the melted water. Combine the coffee, honey syrup and gin in the glass. Stir to chill, then top with tonic water, add more ice as needed and twist a lemon peel over the top of the drink and use as a garnish.,Share this recipe:,Subscribe and Save,,Sign up for our newsletter and get biweekly recipes and articles delivered to your inbox.,Imbibe is liquid culture. In every issue of the James Beard award-winning magazine and on our website, we celebrate drinks as a distinct culinary category, deserving in-depth exploration of the people, places, cultures and flavors that make the world of drinks so fascinating.,Call Us Toll-Free1-877-246-2423or503-595-0144, 1 oz. gin,½ oz. honey syrup (2:1),1½ oz. cold-brew coffee,Fever-Tree tonic water,Tools:barspoon,Glass:Collins,Garnish:lemon peel"
2018-02,"Bastion, Nashville,Photo:Maddie Teren,February 28, 2018,ThePalomais beloved on both sides of the border, but when mezcal and Ancho Reyes come into play instead of tequila, the drink takes on new layers of smoke and spice.,Share this recipe:,Combine all the ingredients except the club soda in a shaker with ice and shake until chilled. Strain into a Collins glass over ice. Top with soda and garnish.,Share this recipe:,Subscribe and Save,,Sign up for our newsletter and get biweekly recipes and articles delivered to your inbox.,Imbibe is liquid culture. In every issue of the James Beard award-winning magazine and on our website, we celebrate drinks as a distinct culinary category, deserving in-depth exploration of the people, places, cultures and flavors that make the world of drinks so fascinating.,Call Us Toll-Free1-877-246-2423or503-595-0144, 1 1/2 oz. mezcal (Hannigan uses Siete Misterios Doba-Yej),1/2 oz. Ancho Reyes,3/4 oz. fresh grapefruit juice,1/2 oz. fresh lime juice,1/4 oz. agave nectar,2 drops salt solution (1:1 salt to water),Club soda,Tools:shaker, strainer,Glass:Collins,Garnish:grapefruit wedge dipped in sal de gusano (worm salt)"
2017-12,"December 27, 2017,Fresh lemon juice adds the perfect bright pop to this bold cocktail from theLiving Room Barat Charleston’s Dewberry Hotel.,1½ oz. bourbon¾ oz. Averna½ oz. Campari½ oz. Heering cherry liqueur¼ oz. fresh lemon juiceTools: shaker, strainerGlass: cocktailGarnish: large ball or cube of ice,Shake all the ingredients with ice to chill, then strain into a glass holding a single large ball or cube of ice.,Ryan Casey,The Dewberry Hotel, Charleston,Subscribe and Save,,Sign up for our newsletter and get biweekly recipes and articles delivered to your inbox.,Imbibe is liquid culture. In every issue of the James Beard award-winning magazine and on our website, we celebrate drinks as a distinct culinary category, deserving in-depth exploration of the people, places, cultures and flavors that make the world of drinks so fascinating.,Call Us Toll-Free1-877-246-2423or503-595-0144, "
2018-01," Chicago,Photo:Emma Janzen,January 03, 2018,At Jim Meehan’s Chicago bar Prairie School (now closed), the New York Sour gets some Canadian flavor with the addition of rye whiskey and maple syrup.,Share this recipe:,Shake the whiskey, lemon juice and maple syrup in a shaker tin with ice. Strain into a chilled coupe. Float the Malbec on top of the drink.,Share this recipe:,Subscribe and Save,,Sign up for our newsletter and get biweekly recipes and articles delivered to your inbox.,Imbibe is liquid culture. In every issue of the James Beard award-winning magazine and on our website, we celebrate drinks as a distinct culinary category, deserving in-depth exploration of the people, places, cultures and flavors that make the world of drinks so fascinating.,Call Us Toll-Free1-877-246-2423or503-595-0144, 2 oz. rye whiskey,¾ oz. fresh lemon juice,¼ oz. maple syrup,½ oz. dry red wine (Prairie School uses Malbec),Tools:shaker, strainer,Glass:coupe"
2018-01,"January 22, 2018,This yogurt cocktail fromTuskin Portland, Oregon, mirrors the flavors of the restaurant’s Middle Eastern food. “We took a modern classic—the Old Maid cocktail, which is from Sam Ross’ days at Milk & Honey—and we modified it by adding orgeat and yogurt,” says bar manager Tony Contreras, who likes the versatility of yogurt as a cocktail ingredient. “With that base, you can really throw a lot of different flavors at it.”,1½ oz. vodka1 oz. orgeat½ oz. fresh lemon juice½ oz.rich simple syrup(2:1)½ oz. whole milk plain yogurt2 cucumber slicesTools: shaker, strainer, fine strainerGlass: Old FashionedGarnish: cucumber ribbon, dried sumac (optional),Add all of the ingredients to an ice-filled shaker and shake well. Double-strain over fresh ice and garnish with a cucumber ribbon and a sprinkle of dried sumac, if available.,Tony Contreras forTusk, Portland, Oregon,Subscribe and Save,,Sign up for our newsletter and get biweekly recipes and articles delivered to your inbox.,Imbibe is liquid culture. In every issue of the James Beard award-winning magazine and on our website, we celebrate drinks as a distinct culinary category, deserving in-depth exploration of the people, places, cultures and flavors that make the world of drinks so fascinating.,Call Us Toll-Free1-877-246-2423or503-595-0144, "
2018-02," Toronto, Ontario,Photo:Ian Patterson,February 19, 2018,A touch of smoke brings depth to this bittersweet rum cocktail.,This rum cocktail from Sandy De Almeida’s home bar in Toronto is bittersweet, with a touch of smoke.,Share this recipe:,Stir all the ingredients with ice to chill, then strain into an ice-filled glass. Garnish.,Share this recipe:,Subscribe and Save,,Sign up for our newsletter and get biweekly recipes and articles delivered to your inbox.,Imbibe is liquid culture. In every issue of the James Beard award-winning magazine and on our website, we celebrate drinks as a distinct culinary category, deserving in-depth exploration of the people, places, cultures and flavors that make the world of drinks so fascinating.,Call Us Toll-Free1-877-246-2423or503-595-0144, 1 oz. Demerara rum (De Almeida uses El Dorado 12-year-old),1 oz. Campari,¾ oz. Averna,½ oz. mezcal (De Almeida uses Enmascarado 45-proof),1 dash Peychaud’s bitters,Tools:barspoon, strainer,Glass:Old Fashioned,Garnish:orange twist"
2020-03,"Pouring Ribbons, New York City,Photo:John Valls,March 03, 2020,A modern classic made with mezcal.,New cocktails are often born as riffs on old classics, but the genealogical chart of the Naked & Famous reads more like a soap opera plotline, combining elements of a classic cocktail, a modern favorite by acclaimed bartender Sam Ross, and an unexpected base spirit. Joaquín Simó, who created the drink during his tenure at New York’sDeath & Co, has called the cocktail “the bastard love child of a classicLast Wordand [Ross’s]Paper Plane, conceived in the mountains of Oaxaca.”,Using the four-equal-parts structure used by these two cocktails, Simó incorporates Chartreuse from the former and Aperol from the latter to complement the drink’s key ingredient, mezcal. “The botanical intensity of the two liqueurs gives such great length to the drink that it manages to be simultaneously crushable and complex,” says Simó. “There’sjustenough sugar to balance the tart lime and funky, smoky mezcal, but not so much that it gets cloying. It’s a great balancing act that gives the cocktail enough structure to let all its complex ingredients speak in turn, rather than all at once.”,Share this recipe:,Combine all of the ingredients in a shaker with ice and shake until chilled. Strain into a chilled coupe.,Share this recipe:,Subscribe and Save,,Sign up for our newsletter and get biweekly recipes and articles delivered to your inbox.,Imbibe is liquid culture. In every issue of the James Beard award-winning magazine and on our website, we celebrate drinks as a distinct culinary category, deserving in-depth exploration of the people, places, cultures and flavors that make the world of drinks so fascinating.,Call Us Toll-Free1-877-246-2423or503-595-0144, ¾ oz. mezcal,¾ oz. yellow Chartreuse,¾ oz. Aperol,¾ oz. fresh lime juice,Tools:shaker, strainer,Glass:coupe"
2018-08,"Il Porcellino, Chicago,Photo:Emma Janzen,August 27, 2018,Two kinds of rum means double the fun.,In this subtle update on theKingston Negroni, two kinds of Jamaican rum bring extra depth to the traditional recipe.,Share this recipe:,Combine all ingredients in a mixing glass and stir until properly diluted. Strain into a double rocks glass over a large ice cube. Garnish with orange twist.,Share this recipe:,Subscribe and Save,,Sign up for our newsletter and get biweekly recipes and articles delivered to your inbox.,Imbibe is liquid culture. In every issue of the James Beard award-winning magazine and on our website, we celebrate drinks as a distinct culinary category, deserving in-depth exploration of the people, places, cultures and flavors that make the world of drinks so fascinating.,Call Us Toll-Free1-877-246-2423or503-595-0144, ¾ oz. overproof Jamaican rum (Cox uses Smith & Cross),¾ oz. blended Jamaican rum (Cox uses Appleton Estate 12-year Rare Blend),¾ oz. Campari,1 oz. Cocchi Vermouth di Torino,Tools:barspoon,Glass:double rocks,Garnish:orange twist"
2018-05,"Death & Co., Denver,Photo:Elliott Clark,May 07, 2018,A bittersweet symphony of flavors.,Cold brew brings a bittersweet acidity to this tropical highball from the newDeath & Co. outpost in Denver.,Share this recipe:,Combine all the ingredients in a shaker with ice and shake until cold. Strain into a highball over crushed ice and garnish.,Share this recipe:,Subscribe and Save,,Sign up for our newsletter and get biweekly recipes and articles delivered to your inbox.,Imbibe is liquid culture. In every issue of the James Beard award-winning magazine and on our website, we celebrate drinks as a distinct culinary category, deserving in-depth exploration of the people, places, cultures and flavors that make the world of drinks so fascinating.,Call Us Toll-Free1-877-246-2423or503-595-0144, 1 oz. overproof rum (Buhler uses Plantation OFTD),½ oz. Jamaican rum (Buhler uses Smith and Cross),½ oz. blackstrap rum,1 ½ oz. pineapple juice,¾ oz. cold-brew concentrate,½ oz. Demerera syrup (1:1),Tools:shaker, strainer,Glass:highball,Garnish:pineapple fronds, grated nutmeg"
2018-02,"February 20, 2018,Dreaming of the tropics? This breezy blend of rum, citrus, coconut and vanilla will transport you immediately.,1½ oz. gold rum½ oz. overproof rum¼ oz. fresh lime juice¼ oz. fresh lemon juice¼ oz. vanilla syrup2 oz. coconut cream1½ dashes Angostura bittersTools: shaker, strainerGlass: double rocksGarnish: lemon wheel, toasted coconut flakes and a goji berry,Combine the ingredients in a shaker filled with crushed ice. Shake to chill. Strain into glass filled with crushed ice. Top with bitters; garnish.,Jonathan Buckley forSouth Seas Tiki Lounge, Charleston, South Carolina,Subscribe and Save,,Sign up for our newsletter and get biweekly recipes and articles delivered to your inbox.,Imbibe is liquid culture. In every issue of the James Beard award-winning magazine and on our website, we celebrate drinks as a distinct culinary category, deserving in-depth exploration of the people, places, cultures and flavors that make the world of drinks so fascinating.,Call Us Toll-Free1-877-246-2423or503-595-0144, "
2018-12,"December 26, 2018,Inspired by the classicJungle Birdcocktail, Brian Miller lets tequila do the talking in this variation, which also welcomes mezcal, Campari and orgeat to the glass for an extra layer of flavor.,1½ oz. blanco tequila½ oz. mezcal½ oz. Campari½ oz. orgeat½ oz. fresh lime juice½ oz. fresh grapefruit juice1 oz. pineapple juice4 dashs absintheTools: blenderGlass: rocksGarnish: pineapple wedges and leaves,Combine all the ingredients in a blender with 4 large ice cubes and flash blend for five seconds. Pour into a glass and top with crushed ice. Garnish.,Brian Miller,The Polynesian, New York City,Did you enjoy this recipe?Sign upfor our newsletter and get our favorite drink recipes of the moment in your inbox every month.,Subscribe and Save,,Sign up for our newsletter and get biweekly recipes and articles delivered to your inbox.,Imbibe is liquid culture. In every issue of the James Beard award-winning magazine and on our website, we celebrate drinks as a distinct culinary category, deserving in-depth exploration of the people, places, cultures and flavors that make the world of drinks so fascinating.,Call Us Toll-Free1-877-246-2423or503-595-0144, "
2018-09,"September 06, 2018,For this rum cocktail, Gillian White puts a sophisticated twist on her version of theHurricanewith the use of two premium rums and a touch of green Chartreuse. “This drink is meant to be fun and nostalgic … and a bit fruity and boozy too,” she says.,1 oz. Plantation Stiggins’ Fancy Pineapple Rum¾ oz. Plantation O.F.T.D rum¼ oz. green Chartreuse¼ oz.grenadine½ oz. passion fruit syrup (such asSpeed Craft)¾ oz. fresh lime juiceTools: shakerGlass: CollinsGarnish: half orange wheel, grated nutmeg,Shake all the ingredients in a shaker with ice. Pour the contents of shaker into a Collins glass and top with cracked ice. Garnish.,Gillian White,Meauxbar, New Orleans,,Did you enjoy this recipe?Sign upfor our newsletter and get our favorite drink recipes of the moment in your inbox every month.,Subscribe and Save,,Sign up for our newsletter and get biweekly recipes and articles delivered to your inbox.,Imbibe is liquid culture. In every issue of the James Beard award-winning magazine and on our website, we celebrate drinks as a distinct culinary category, deserving in-depth exploration of the people, places, cultures and flavors that make the world of drinks so fascinating.,Call Us Toll-Free1-877-246-2423or503-595-0144, "
2018-01,"Craft+Cocktails,Photo:Photo by Ashley Rose Conway,January 24, 2018,Move over Mimosa—there’s a new drink at the brunch table.,Move over mimosa, thisBreakfast Bramblemight just be the perfect brunch cocktail. Ashley Rose Conway, fromCraft+Cocktails, combines two breakfast table staples—jam andyogurt—to a create a cocktail that’s lightly creamy and perfectly sweet and tangy.,Share this recipe:,Combine all the ingredients in a shaker with ice. Shake and strain into a glass with fresh crushed ice and garnish.,Share this recipe:,Subscribe and Save,,Sign up for our newsletter and get biweekly recipes and articles delivered to your inbox.,Imbibe is liquid culture. In every issue of the James Beard award-winning magazine and on our website, we celebrate drinks as a distinct culinary category, deserving in-depth exploration of the people, places, cultures and flavors that make the world of drinks so fascinating.,Call Us Toll-Free1-877-246-2423or503-595-0144, 1½ oz. gin,¾ oz. crème de mûre (blackberry liqueur),1 ½ Tbsp. stone fruit jam (Conway uses apricot rosemary jam from The Jam Lab),1 Tbsp. plain Greek yogurt,½ oz. fresh lemon juice,Tools:shaker, strainer,Glass:Old Fashioned,Garnish:fresh blackberries, lemon slice"
2018-04,"Margo’s, Santa Monica, California,Photo:Courtesy of Margo's,April 26, 2018,Avocado lends a creamy texture to this mezcal margarita.,Share this recipe:,Rim a glass with chili salt and add ice and set aside. In a shaker, add the avocado and ice. Shake hard to break down the avocado. Add the mezcal, lime, agave and shake until cold. Strain into a prepared rocks glass. Garnish.,Margo’s Chile Salt: Add 2 parts of kosher salt to 1 part Aleppo pepper and a dash of cayenne.,Share this recipe:,Subscribe and Save,,Sign up for our newsletter and get biweekly recipes and articles delivered to your inbox.,Imbibe is liquid culture. In every issue of the James Beard award-winning magazine and on our website, we celebrate drinks as a distinct culinary category, deserving in-depth exploration of the people, places, cultures and flavors that make the world of drinks so fascinating.,Call Us Toll-Free1-877-246-2423or503-595-0144, 2 oz. mezcal,1 oz. fresh lime juice,¾ oz. agave syrup,¼ ripe avocado,Chili salt for rim,Tools:shaker, strainer,Glass:rocks,Garnish:lime wheel"
2018-02,"The Macintosh, Charleston, SC,Photo:Andrew Cebulka,February 10, 2018,Orange jam and bourbon mimic the tried-and-true combo.,Inspired by the tried-and-true combo of jam on toast, this brunch cocktail from Charleston perfectly translates breakfast to the cocktail glass.,Share this recipe:,Shake all the ingredients well, pour the contents into a double rocks glass. Garnish.,Share this recipe:,Subscribe and Save,,Sign up for our newsletter and get biweekly recipes and articles delivered to your inbox.,Imbibe is liquid culture. In every issue of the James Beard award-winning magazine and on our website, we celebrate drinks as a distinct culinary category, deserving in-depth exploration of the people, places, cultures and flavors that make the world of drinks so fascinating.,Call Us Toll-Free1-877-246-2423or503-595-0144, 1½ oz. bourbon,¼ oz. Drambuie,½ oz. honey syrup,½ oz. fresh lemon juice,1 heaping barspoon orange marmalade,2 dashes Bittermen's Mole bitters,Tools:barspoon, shaker, strainer,Glass:double rocks,Garnish:thyme sprig, orange slice"
2018-08," circa 1937, adapted by Jeff “Beachbum” Berry,Latitude 29, New Orleans,Photo:Max Kelly,August 20, 2018,A tropical classic unearthed by Jeff “Beachbum” Berry.,The Kona Cocktail recipe from Don the Beachcomber was only recently revealed by tiki historian Jeff “Beachbum” Berry in the newest edition ofSippin’ Safari. The original Jamaican rum used in this circa 1937 recipe no longer exists; Berry suggests using Rum-Bar Gold or Hamilton Jamaican Gold as a replacement.,Share this recipe:,Combine all of the ingredients in a blender and blend on high for 20 seconds, or until pineapple has liquified. Strain through a medium-mesh strainer into a chilled glass, agitating as you strain to force as much liquid as possible into the glass.,Share this recipe:,Subscribe and Save,,Sign up for our newsletter and get biweekly recipes and articles delivered to your inbox.,Imbibe is liquid culture. In every issue of the James Beard award-winning magazine and on our website, we celebrate drinks as a distinct culinary category, deserving in-depth exploration of the people, places, cultures and flavors that make the world of drinks so fascinating.,Call Us Toll-Free1-877-246-2423or503-595-0144, 1 oz. gold Jamaican rum,½ oz. fresh lime juice,¼ oz. passion fruit syrup,¼ oz. honey syrup (1:1),2 Tbsp. diced fresh pineapple,½ cup crushed ice,Tools:blender, medium-mesh strainer,Glass:cocktail"
2018-12,"Raised by Wolves, San Diego,Photo:Anne Watson,December 29, 2018,High-proof bourbon sets a bold tone for this tropical refresher from Raised by Wolves in San Diego.,Share this recipe:,Combine all ingredients in a mixing tin with ½ oz. pebble ice and shake to briefly chill and dilute. Strain into a chilled filled with pebble ice. Garnish.,,,Share this recipe:,Subscribe and Save,,Sign up for our newsletter and get biweekly recipes and articles delivered to your inbox.,Imbibe is liquid culture. In every issue of the James Beard award-winning magazine and on our website, we celebrate drinks as a distinct culinary category, deserving in-depth exploration of the people, places, cultures and flavors that make the world of drinks so fascinating.,Call Us Toll-Free1-877-246-2423or503-595-0144, 2 oz. bourbon (Castro uses Maker's Mark Cask Strength),¾ oz. fresh lemon juice,1 oz. pineapple juice,½ oz. falernum,½ oz. simple syrup (1:1),2 dashes Angostura bitters,Tools:shaker, strainer,Glass:hurricane,Garnish:cinnamon stick and mint sprig"
2018-04,"Hotel Kabuki, San Francisco,Photo:Aubrie Pick,April 12, 2018,A bright and frothy combo of gin, hibiscus, lemon and egg white.,A floral syrup richens the dry, herbaceous character of gin in this hibiscus cocktail from Hotel Kabuki.,Share this recipe:,Shake all the ingredients with ice then strain into a tin. Shake one more time without ice, then double strain into a chilled coupe. Garnish.,Share this recipe:,Subscribe and Save,,Sign up for our newsletter and get biweekly recipes and articles delivered to your inbox.,Imbibe is liquid culture. In every issue of the James Beard award-winning magazine and on our website, we celebrate drinks as a distinct culinary category, deserving in-depth exploration of the people, places, cultures and flavors that make the world of drinks so fascinating.,Call Us Toll-Free1-877-246-2423or503-595-0144, 2 oz. dry gin (Hotel Kabuki uses St. George Terrior),1 oz. hibiscus tea syrup,1/2 oz. fresh lemon juice,1 fresh egg white (pasteurized, if you like),3 dashes Peychaud's bitters,Tools:shaker, strainer,Glass:coupe,Garnish:cherry blossom petals (optional)"
2018-05,"May 07, 2018,Death & Co. beverage director Tyson Buhler combines flavors of smoke, fruit and spice in this stunning stirred cocktail.,1¼ oz. bourbon½ oz. Scotch¼ oz. Jamaican rum2 tsp. coffee liqueur1 tsp. passion fruit liqueurTools: barspoonGlass: Old FashionedGarnish: orange twist,Combine all the ingredients in a mixing glass with ice and stir to chill. Strain into an Old Fashioned glass over a single ice cube. Garnish.,Tyson Buhler,Death & Co.Denver,Did you enjoy this recipe?Sign upfor our newsletter and get our favorite drink recipes of the moment in your inbox every month.,Subscribe and Save,,Sign up for our newsletter and get biweekly recipes and articles delivered to your inbox.,Imbibe is liquid culture. In every issue of the James Beard award-winning magazine and on our website, we celebrate drinks as a distinct culinary category, deserving in-depth exploration of the people, places, cultures and flavors that make the world of drinks so fascinating.,Call Us Toll-Free1-877-246-2423or503-595-0144, "
2018-01," Houston,Photo:Max Kelly,January 02, 2018,Blackberry liqueur deepens the flavors of this bourbon cocktail from Better Luck Tomorrow.,Houston bartender (and 2018 Bartender of the Year) Alex Negranza—who moved to the city from Seattle—named this drink for fellow transplant Slick Watts, an NBA point guard who played for the Seattle Supersonics from 1973 to 1978 before moving to Texas to play for the Houston Rockets.,Share this recipe:,Stir all of the ingredients with ice to chill, strain into an ice-filled glass, then garnish.,Share this recipe:,Subscribe and Save,,Sign up for our newsletter and get biweekly recipes and articles delivered to your inbox.,Imbibe is liquid culture. In every issue of the James Beard award-winning magazine and on our website, we celebrate drinks as a distinct culinary category, deserving in-depth exploration of the people, places, cultures and flavors that make the world of drinks so fascinating.,Call Us Toll-Free1-877-246-2423or503-595-0144, 1½ oz. bourbon,¾ oz. sweet vermouth (such as Cocchi Vermouth di Torino),¼ oz. Campari,¼ oz. crème de mure,1 dash Peychaud’s bitters,Tools:barspoon, strainer,Glass:highball,Garnish:orange peel, blackberry, cherry"
2018-12,"Dead Rabbit, New York City,Photo:Gregory Buda,December 29, 2018,Perfect for your next fall gathering.,Blending the malty flavors of Irish whiskey with the bright fruity notes of Calvados and citrus makes this punch from Dead Rabbit a perfect crowd-pleaser (the recipe makes enough for 10 people). Genmaicha is a puffed brown rice tea that’s available at most grocery stores, tea shops and Asian markets. “Tea is common in punches, and this one in particular was chosen to go with the grain and malt notes of the Irish whiskey,” says bartender Jillian Vose.,Share this recipe:,Fill a large punch bowl with a block of ice and add all the ingredients. Stir to combine. Use a ladle to pour single servings into glasses and garnish with freshly grated nutmeg.,Cinnamon Syrup:1 oz. crushed cassia cinnamon bark3 cups water3 cups fine sugar,Combine all the ingredients in a pot. Bring to a boil, stirring frequently. Remove from the heat and store in a clean container at room temperature for 12 hours. Strain through a fine mesh strainer, bottle, label and store in refrigerator. Makes 1 liter.,Genmaicha Tea Syrup:1 oz. Genmaicha tea3 cups water3 cups fine sugar,Combine all the ingredients in a pot. Bring to a boil, stirring frequently. Remove from the heat and store in a clean container at room temperature for 30 mins. Strain through a fine mesh strainer, bottle, label and store in refrigerator. Makes 1 liter.,Share this recipe:,Subscribe and Save,,Sign up for our newsletter and get biweekly recipes and articles delivered to your inbox.,Imbibe is liquid culture. In every issue of the James Beard award-winning magazine and on our website, we celebrate drinks as a distinct culinary category, deserving in-depth exploration of the people, places, cultures and flavors that make the world of drinks so fascinating.,Call Us Toll-Free1-877-246-2423or503-595-0144, 10½ oz. Irish whiskey (Vose uses Bushmills Red Bush),5 oz. Calvados,2½ oz. fresh pineapple juice,7½ oz. fresh lemon juice,2½ oz. cinnamon syrup,5 oz. Genmaicha green tea syrup,20 dashes peach bitters (Vose uses Bittered Sling),Tools:shaker, strainer,Glass:rocks, mug or punch,Garnish:grated nutmeg"
