Date,Ingredients
2022-03,i’ll never get tired of refreshing summer cocktail recipes. this strawberry gin rickey cocktail is a sweet and fruity cocktail with gin. you need to make a strawberry basil simple syrup and then combine it with the other ingredients. this is a tasty variation on a classic gin rickey to try this summer.
2022-04,"my blueberry lemon and cucumber gin mojitos combine sweet blueberries with refreshing lemon, cucumber and mint. a healthy dose of gin unites the flavour profiles of these late summer sippers and a splash of soda water adds just the right amount of sparkle. my gin mojitos are free of refined sugars and made with all natural ingredients — so the next time you’re craving a cooling summer cocktail, indulge yourself with a fresh twist on the classic mojito!"
2021-11,"a french gimlet is a sophisticated st germain cocktail with a spin on the classic! three ingredients (st germain, lime and gin) combine make this refreshing and chic drink."
2022-05,"hawaiian mimosas - this easy cocktail recipe has just three ingredients and will make you think you're on a beach in paradise. pineapple, rum, and champagne is all it takes to make this delicious cocktail!"
2022-01,"i have a yummy winter cocktail recipe for you today. the presentation of it is so cute too, perfect for a winter gathering with friends! it’s a creamy drink that tastes like smores complete with a roasted marshmallow on top! i like to serve with molasses gingersnap cookies! yield: 1author: my sweet savannahprint recipe campfire cocktail ingredients: mix ... read more about campfire cocktail recipe"
2020-12,"a magical color-changing galaxy lemonade recipe inspired by the new book, sanity & tallulah by molly brooks."
2022-02,"fact: a little bit of sparkling prosecco will make any drink a lot more festive. whip up one of these simple, bubbly cocktail recipes the next time you need to impress your girlfriends. or your in-laws. or heck, yourself. whether you need a crowd-pleasing punch for a new year’s eve bash or a..."
2022-05,"this lychee mojito is an exotic, floral take on the every day mojito. filled with lychees, strawberries, a splash of rose water and white rum."
2022-03,a frozen gin and tonic recipe to cool you down during the hot summer months!
2022-05,"looking for a strawberry mojito recipe for cachaça or dark rum? this classic cocktail is a drink with strawberries, mint and lime. while a mojito has always been an easy summer cocktail recipe, adding strawberries dials up the flavour. you can make also this cocktail with white rum or cachaça."
2022-04,"elderflower and gin make the perfect pairing for spring cocktails! light, floral, elegant - these three simple cocktail recipes are ideal for spring sipping."
2021-12,this easy cranberry moscow mule is the perfect holiday cocktail!
2021-12,"a festive fall cocktail that boasts all fresh flavors of autumn with a little apple, maple, and bourbon!"
2022-04,how to make the best old fashioned cocktail at home with bourbon like a professional mixologist at a fancy restaurant
2021-12,"this summery strawberry lime vodka smash is the perfect vodka cocktail to sip on a hot day! sweet, tart, refreshing and easy to make!"
2021-10,visit entertaining blog the sweetest occasion for the best summer cocktail recipes including this mango sunrise piña colada recipe perfect for summer parties!
2020-05,"the sex in the driveway cocktail recipe is a variation on the sex on the beach cocktail. it replaces the cranberry juice with blue curacao, so you get a drink that's blue in color and more orange in flavor."
2021-11,"mint strawberry moscow mule is the perfect summer cocktail. made with vodka and ginger beer, its super easy and our go to drink these days!"
2020-05,"frozen peach bellini cocktail – light, refreshing and super easy to make! this elegant cocktail slush will be a hit for any summer party. all you need is 3 ingredients and 5 minutes – s…"
2022-04,"elderflower and gin make the perfect pairing for spring cocktails! light, floral, elegant - these three simple cocktail recipes are ideal for spring sipping."
2020-08,"wine lovers, this moscow mule is for you!! sangria mexican mule is a tequila based version of the classic moscow mule along with red wine and berries. making it fruity, zingy and a guaranteed win."
2022-04,from prickly pear margaritas to lavender gin and tonics.
2020-08,"add the punch you need to your drink, and treat yourself to the pineapple mango rum punch."
2021-10,"it’s time to put away the rosé (see you next june) and retire those spritzy spiked seltzers you’ve been drinking all summer. fall is here, and with it, a new set of libations to warm you up from the inside out. think maple new york sours, cider spiked with bourbon and pumpkin..."
2021-11,"this raspberry gin fizz is the perfect spring or summer cocktail. it's not only beautiful, it's super tasty."
2022-04,love a delicious 3 ingredient drink recipe? this creamy root beer rum cocktail tastes like an adult version of a root beer float.
2021-04,"“i think this has all the flavours of spring, plus my favourite new ingredient to experiment with: blueberries!”"
2022-04,"for spring, i’m loving this rosemary grapefruit refresher. it’s so yummy and light, and it works for brunch or dinner time sipping. i just love how the..."
2022-02,"wine lovers, this moscow mule is for you!! sangria mexican mule is a tequila based version of the classic moscow mule along with red wine and berries. making it fruity, zingy and a guaranteed win."
2020-06,this peach rosé sangria is an easy to make summer cocktail that's perfect for a party or sipping on the patio on a hot day!
2021-05,"these two creamy cocktails have been inspired by bahlsen choco leibniz with a taste baileys, which we sent to our members in their october 2020 gin of the month boxes. each of these easy cocktail recipes combines chocolate, baileys and gin in the most delectable ways!"
2022-05,"when you want a refreshing caribbean beverage, enjoy a tall glass of my pink pirate rum punch. a hammock on a white sand beach is one of my favorite places"
2021-05,"this raspberry limoncello prosecco is the perfect sparkling summer cocktail to enjoy year round, made with fresh muddled raspberries, lemon, and your favorite wine."
2020-12,"this 7-ingredient blackberry basil mojito is refreshing, simple to make, and a lovely balance of tart and sweet. perfect for happy hours, entertaining, and making the most of all that beautiful summer produce."
2022-02,"it might be time for a vacation. lately i've been dreaming of a small island, someplace warm and tropical, where i can sit back and run my toes through the perfect white sand while sipping delicious cocktails. this colada sunrise is just the thing. to riff on a traditional piña colada, i added some mango juice and grenadine, giving it lots of fruity flavor and beautiful colors. best of all, it’s low-proof enough that you can probably enjoy more than one before moving onto your typical daiquiri, margarita, or other warm-weather drink."
2021-12,"fact: a little bit of sparkling prosecco will make any drink a lot more festive. whip up one of these simple, bubbly cocktail recipes the next time you need to impress your girlfriends. or your in-laws. or heck, yourself. whether you need a crowd-pleasing punch for a new year’s eve bash or a..."
2022-03,"with only 4 ingredients, this delicious blueberry margarita recipe comes together in a matter of minutes. simple, smooth, and sweet!"
2021-12,this christmas punch is the perfect drink to serve at any holiday gathering! make it with sparkling wine or alcohol-free!
2020-10,a black magic/galaxy cocktail that is shimmering and black. a mix between a lime daiquiri and lime martini.
2022-01,"this lemon drop martini with limoncello is one of the best lemon drop martini recipes! plus, i love a good limoncello cocktail recipe, you can never go wrong."
2020-02,several weeks ago i was contacted by a pr firm asking if bourbon & banter would be interested in having one of the mixologists that represented create
2021-12,apple cider sangria the perfect fall cocktail recipe.
2020-07,"a fresh, summer-friendly grapefruit cocktail perfect for outdoor parties"
2022-01,a peanut butter white russian is a delicious twist on a classic cocktail. it’s smooth and creamy and quite possibly the perfect after dinner treat.   while a cl…
2020-12,"hawaiian mimosas - this easy cocktail recipe has just three ingredients and will make you think you're on a beach in paradise. pineapple, rum, and champagne is all it takes to make this delicious cocktail!"
2020-02,"the dirty shirley temple is made with ginger ale, grenadine, maraschino cherries and vodka to turn a favorite childhood beverage into an adult one!"
2022-01,"this martini made from fresh blood orange juice, vodka and triple sec tastes just as delicious as it looks."
2022-01,this delicious salty dog cocktail is my favorite beach cocktail. the mix of grapefruit and vodka with a hint of lime and salt is so refreshing and tasty!
2019-01,transport yourself somewhere sunny and relaxing with this tropical fruit and coconut rum caribbean punch cocktail/
2021-10,"we compiled 20 of the best two-ingredient cocktails, featuring gin, tequila, vodka, whiskey, bourbon, scotch, rum & liqueur. get the recipes!"
2020-12,adapted from the berry bible. the simple syrup recipe in the notes is for a larger batch of simple syrup to keep on hand. it keeps for months in the fridge if you store it in a clean container. if you don't want to make the simple syrup (although it always great to have on hand) you can muddle in about 1 tablespoon (or to taste) of sugar instead.
2018-12,this light and refreshing gin cocktail is sweetened with pomegranate juice and spicy ginger beer. the ultimate crowd-pleasing cocktail recipe!
2021-04,"the long beach iced tea is like a long island iced tea, except you swap the cola for cranberry juice. it's a tart, refreshing drink. it's also madly strong, so if you want to make it more of a standard drink, just use an ounce and a half of one of the white liquors and leave the rest out."
2022-02,"this blackberry tequila spritzer is earthy, zesty and full of texture. it’s focused on the flavor of quality tequila, blackberries and a red wine float."
2019-12,"one sip of this and you won't want any other warm winter cocktail ever again. it's rich, creamy and loaded with bailey's. the perfect winter cocktail for snuggling up with on christmas eve while watching a christmas film."
2021-01,"what better way to celebrate bourbon heritage month than with a dozen classic cocktails. we start out with two favorites, neat and on the rocks. stop here?"
2019-07,"the best fresh raspberry mojito recipe - made with agave, fresh lime, mint and raspberries. minty refreshing mojitos with a touch of fresh raspberry make the perfect party cocktail. cheers!"
2022-03,mix up this easy adult pink lemonade recipe for your summer parties and barbecues and turn your favorite childhood drink into a summer cocktail!
2022-02,"this pineapple mango rum punch is a special recipe that will make you feel like you’re in the caribbean. this recipe is super easy to make, and perfect for parties and entertaining."
2021-03,"this strawberry basil margarita is a fun twist on the classic margarita. it's a sweet, tart and refreshing cocktail, perfect for celebrating."
2021-12,this christmas martini is easy to make and perfect for holiday festivities! it's a cranberry cocktail that's sweet tart and drinkable.
2021-12,"blending with ice makes this mango daiquiri the perfect summer cocktail. sweet and brimming with mango flavour, this colourful drink is also very easy to make."
2019-05,"the painkiller was first made in the british virgin islands with pusser’s navy rum. you may notice it on menus with the numbers #2, #3, and #4 after its name; that indicates how many ounces of rum are used. it’s essentially a boozier piña colada, and is sure to drown any and all sorrows."
2020-07,"electric lemonade is an easy party punch recipe! this lemonade pitcher cocktail has lemonade, blue curaçao, vodka and a natural sweetener syrup to make it as sweet as you want it. this is the perfect summer cocktail recipe!"
2020-04,"this earl grey blackberry bourbon cocktail is rich, warm and fruity. it’s the perfect cocktail to drink as summer turns into fall. get the recipe."
2021-01,"today i’ve listed out some delicious, natural, low sugar tequila recipes to help you celebrate cinco de mayo the right way!"
2019-04,"this icy peach bourbon cocktail is the perfect refreshing sip on a hot summer night! inspired by my trip to wiggly bridge distillery in york, maine."
2020-01,"it’s time to put away the rosé (see you next june) and retire those spritzy spiked seltzers you’ve been drinking all summer. fall is here, and with it, a new set of libations to warm you up from the inside out. think maple new york sours, cider spiked with bourbon and pumpkin..."
2020-10,thanksgiving bourbon pecan pie in a glass!
2019-05,the paloma is a mexican favorite cocktail. made with fresh grapefruit juice and silver tequila it's is arguably more refreshing than a margarita.
2022-02,"celebrate fall weather and flavors by mixing up a apple pie moscow mule! apple cider serves as the base of this cocktail. mix with ginger beer, vodka, a squeeze of lime and cinnamon simple syrup. sweet, but not too sweet, this autumnal twist on a classic moscow mule tastes like a slice of apple pie. whether you're serving yourself or a crowd, these apple pie moscow mules are flavor-filled, balanced, unique cocktail to serve at any gathering!"
2022-01,"this classic gin cocktail is perfectly balance with just the right amount of sweetness plus citrus.  with only 3 ingredients, it's also so easy to make!"
2021-04,"fresh raspberries and sweet raspberry jam, smashed together with rosemary, lemon, apple cider vinegar, vodka, and fizzy sparkling water."
2019-03,"this raspberry mojito recipe is an easy refreshing summer drink that combines sweet raspberries, rum, and mint for the perfect sit-back-and-relax drink."
2021-10,"this cranberry thyme spritz is this year's party punch. not only is it extra festive and pretty, but it's sweet, hinted lightly with flavors of thyme, spiked with a little vodka, and made with my very favorite, elderflower liquor. it's basically the perfect sweet holiday drink."
2021-04,"these grapefruit margaritas are a healthy spin on the classic cocktail that use just 4 ingredients. they're light, refreshing and have no added sugar!"
2021-05,this party worthy appletini is a four ingredient delicious sour apple cocktail that is made in less than two minutes.
2020-05,"strawberry lime vodka tonic is made with vodka, tonic water, freshly squeezed lime juice, fresh strawberries and just a pinch of sugar with a sugar rim and a lime slice garnish."
2020-04,cranberry orange gin fizz is a festive cocktail filled with holiday flavor! this easy drink recipe uses a naturally sweetened homemade cranberry sauce for a big punch of flavor.
2021-11,"blackberry bourbon smash is a blackberry cocktail created for those who love bourbon whiskey. a refreshing, fruity, twist on a timeless classic. mix up one tonight."
2020-01,"gin and tonic with grapefruit & rosemary summer cocktail recipe - great for brunch, parties, weekends and happy hour! click through to get the easy recipe!"
2020-04,"day 98 bahama mama 5 shots out of 5 i have had this cocktail on one of my boards on pinterest for a while now. all i was missing was my captain morgans spiced rum. made a grocery shopping run today and picked it up so that i could make a bahama mama, and boy am i glad i did!! i gave tonight's cocktail 5 shots out of 5. i found this cocktail on pinterest where it was linked to ecurry blog. thank you for sharing the scrumptious bahama mama with us all! this cocktail is all kinds of amazing. i can smell the banana liqueur when i take a sip, which as we know, makes me happy. the 2 rums together with the juices......mmmmmm, what a great blend! even my husband likes it! i gave him the glass after i took a sip, went to put away my bottles then came back to drink it and write my blog.......and........it was almost half gone! if it wasn't so late, i would definitely make another one when this one is gone. this cocktail is a must try! here is a photo of the end result: here is a photo of the ingredients: here is the recipe for a bahama mama: 3/4 ounce coconut rum 3/4 ounce banana liqueur 1 ounce spiced rum 1 1/2 ounces orange juice 2 1/2 ounces pineapple juice 1 tablespoon grenadine in a shaker add ice and all of the ingredients. shake it up real good to mix everything up well. in a hurricane glass, fill 1/2 way with crushed ice and then strain in your cocktail. since we had to watch the american idol finale (not commenting on who won), tonight's cocktail was made later. since tonight's cocktail was made later............i only get 1.......boo. cheers!! the cocktail lady"
2019-02,"for spring, i’m loving this rosemary grapefruit refresher. it’s so yummy and light, and it works for brunch or dinner time sipping. i just love how the..."
2020-06,"this raspberry limoncello prosecco is the perfect sparkling summer cocktail to enjoy year round, made with fresh muddled raspberries, lemon, and your favorite wine."
2022-04,"a cosmopolitan cocktail is a simple four-ingredient vodka drink that is so easy to make at home. it’s pink, a little tart and a little sweet and a perfect cocktail for happy hour!"
2021-09,"this strawberry mojito is made with fresh muddled strawberries and mint and as always, a generous helping of rum"
2016-10,"sip on this pretty blue devil cocktail as you are chilling out by the pool. made with rum, blue curacao and orange juice it is a cocktail perfect for the summer with its tropical flavors."
2021-12,"i promised over the summer when i shared my grapefruit moscow mule recipe that i was going hard on moscow mules from basically now until eternity. i'm making good on my word today, with your"
2021-05,this key lime cocktail with coconut rum and fresh key limes is a delicious summer slushie for the grown-ups! this will cool you off all summer long.
2020-05,"it's no secret we love margaritas, but there is so much more to do with tequila! from fruity drinks to coffees and spiced drinks, these tequila drinks that aren't margaritas are sure to be a favorite."
2020-07,"entertaining season is upon us and you know what that means...time to drink champagne and dance on tables! no, but seriously...we are all eagerly awaiting summer and the festive gatherings that come along with it. we"
2019-02,"whiskey lemonade made with homemade lemonade from freshly squeezed lemons, sweetened with honey rather than sugar, and mixed with a shot of whiskey.  it's easy, refreshing and made in a pitcher so its easy to share with friends."
2022-03,"this national vodka day cocktail is a sparkling fig and vanilla bean vodka libation called the ""no fig deal,"" made with pau maui vodka!"
2020-09,"it’s time to put away the rosé (see you next june) and retire those spritzy spiked seltzers you’ve been drinking all summer. fall is here, and with it, a new set of libations to warm you up from the inside out. think maple new york sours, cider spiked with bourbon and pumpkin..."
2020-02,"it’s time to put away the rosé (see you next june) and retire those spritzy spiked seltzers you’ve been drinking all summer. fall is here, and with it, a new set of libations to warm you up from the inside out. think maple new york sours, cider spiked with bourbon and pumpkin..."
2021-07,a spicy margarita that's so good it will change your life and have everyone begging for more!
2021-09,"the sex on the beach cocktail is a classic drink recipe. it features vodka, peach schnapps, grapefruit juice (or orange juice) and cranberry juice. the taste is fruity with just enough tartness to keep it from being too sweet. the alcohol flavor isn't very noticeable."
2020-06,"spicy salty dog - freshly squeezed grapefruit juice, vodka, and jalapenos! so refreshing and delicious, the perfect spicy cocktail."
2020-08,"not too sweet or too tart, this cosmopolitan cocktail recipe is perfect to serve one or many. we like to use unflavored or citrus flavored vodka in this. if you can, since there is quite a lot of vodka in the recipe, choose vodka that is medium priced or that’s even top-shelf. we like to use stolichnaya. we love adding a little orange peel to this. sure, it may look like an unnecessary garnish, but if you do it right, it’s adds a little sweetness and as you go into to take a sip of the cosmopolitan cocktail, you’ll get orange essence, which hides the strength and scent of the vodka. when you add the orange peel, peel it over the drink. this way, any oils that spray out from the orange, fall into the drink. rubbing the edges of the glass doesn’t hurt either."
2021-03,easy to make paloma cocktail recipe using grapefruit and tequila as main ingredients. perfect party drinks with fewer efforts!
2022-04,spruce up your brunch cocktail by swapping out your orange juice with pink lemonade.
2021-09,sour spicy green apple margarita • for your st. patrick's day party • hpnotiq breeze • mad hatter • the shamrock-arita • more ...
2022-04,"a vintage 1920's cocktail made from a refreshing mix of fresh lime juice, sparkling water and gin. this modern gin rickey with rosemary honey simple syrup. fresh rosemary is steeped in hot water and blended with honey to lightly sweeten the drink."
2022-05,a perfectly refreshing summer cocktail awaits you! muddled raspberries and mint combine with delicious ginger beer & a little rosé wine - a winning combination!
2022-04,"a bourbon smash made with fresh lime, fresh mint leaves, blackberries, and simple sugar."
2022-05,"last year, by request, we created a nine mocktail recipes. we were shocked by just how popular these original mocktails were, so we went back to the kitchen."
2020-04,"an epic grapefruit salty dog cocktail that'll be the envy of summer! this refreshing salty dog drink is a mix of fresh grapefruit juice, vodka, sparkling water with a hint of lime."
2019-08,"tropical rum punch is a delicious cocktail recipe to make for a party or sip by the pool. a mix of juices, peach schnapps and coconut rum layered with fruit. with just one taste and you'll be transported to the beach!"
2021-05,"the gin gimlet cocktail is one of those classics that have been around forever, and with good reason. the original gin gimlet was 2-parts gin to 1-part rose's lime juice. rose's lime juice is lime juice that is preserved with sugar, making it not only sweet but also shelf-stable. this gave the gin gimlet a tart and sweet flavor beloved by so many of us and as well as a prominent place in cocktail history."
2019-07,lavender gin and tonic punch is light and refreshing! it's naturally flavored and the beautiful purple color is from butterfly pea tea. absolutely perfect party punch for spring and summer.
2021-12,"the apple cider mule is a mix of kinky vodka, limes, apples, apple cider, ginger beer, and spiced bitters to create a fusion of fall flavors for the perfect seasonal drink!"
2022-04,this is the best frozen strawberry daiquiri recipe ever! what really makes it so special is the splash of lime juice and how simple it is. just 4 simple ingredients in barely 5 minutes!
2021-05,"nothing says summer like a freshly cut slice of watermelon. this recipe from our friends at the national watermelon promotion board does the sweet fruit justice in the form of a boozy, colorful cocktail on the rocks."
2021-05,"indulge in an aperol aranciata cocktail during blood orange season on house - design, food and travel by house & garden"
2021-10,"talk about a holiday spirit! cranberry moscow mules are a perfectly sweet-tart, festively-hued seasonal drink. this classic cocktail with a twist will be a hit with merry-makers at all of your parties. craft individually, or create a large batch base so guests can make their own at a self-serve mule station."
2019-07,"these creamsicle prosecco floats are reminiscent of a childhood favorite treat, and only require 3 ingredients! they are perfect for brunch with friends, dessert on a warm night, or whenever you want to treat yourself!"
2019-03,"a tropical marriage of orange and cranberry juices, vodka with a hint of peach and vanilla float over ice, your ultimate sexy cocktail!"
2022-02,"the moscow mule, in addition to being delicious, is the perfect cocktail to make at home. it’s simple and fresh, and will impress your friends, especially during the holiday season. i like to add some fruity variation to the classic recipe, usually in the form of a simple syrup. simple syrups are great to use in cocktails, as they add a lot of flavor without diluting the drink substantially. they’re also very easy to prepare: mix together 1 cup of sugar and 1 cup of water, then add a specific spice, fruit, or flavor. the mixture is then poured into a saucepan and heated until the sugar is dissolved. afterwards, strain the mixture and chill for your next cocktail concoction. as it happens, cranberries are currently in season and perfect for a simple syrup, as they add both bitter flavor and sweetness. to make it, add ½ cup of fresh cranberries to the standard simple syrup recipe. after the sugar is dissolved into the water the mixture is then strained into a container and can be used in all your holiday cocktails for up to two weeks. in addition to the cranberry simple syrup, the ginger beer adds a spicy festive flavor. so if you’re planning any holiday parties this year, consider making the fun and spirited cranberry moscow mule!"
2022-04,"a fruity and refreshing summer vodka cocktail made with muddled fresh strawberries and raspberries, fresh rosemary, blackberry jam, honey syrup, and lemon juice."
