Date,Ingredients
2020-11,"a white christmas margarita pitcher recipe that will not disappoint. this creamy coconut margarita with lime juice, tequila, coconut water and cranberries tastes like summer and looks like christmas in a cup."
2022-02,these beautiful cocktail recipes are inspired by the gorgeous meringue bars from flower & white that can be found in our april 2021 gin of the month box. give our dessert-inspired lemon meringue martini gin cocktail a go along with our raspberry & white chocolate cocktail and the rest of the
2020-08,"you can make a strawberry daiquiri with either fresh fruit or frozen. this recipe is for frozen strawberries since you can get quality ones all year round. you can make with fresh strawberries if you have them. hull & slice the strawberries. add an extra 1/2 - 1 cup of ice (1 1/2 - 2 cups total), depending on the warmth of your other ingredients.this recipe is written for 2-3 cocktails (depending on how full you want to fill the glasses). it feels like a waste to pull out the blender for just one cocktail."
2020-11,blue hawaiian party punch is a simple vodka punch recipe that is perfect for a summer bbq.
2021-10,"this classic lemon drop martini recipe is a lemontini everyone will love. lemon drops are made with vodka, lemon, triple sec and simple syrup and are so refreshing. this is a delicious and easy cocktail recipe."
2020-05,"[i]a refreshing twist on a classic margarita with fresh blood orange juice, triple sec and fresh squeezed lime juice! [/i]"
2019-10,the refreshing elderflower gin cocktail gets a pop of color and flavor from the addition of blood orange juice.
2019-05,"the classic paloma is an easy-to-make cooler that combines tequila, lime juice and grapefruit soda."
2021-10,hot buttered rum is so comforting and easy to prepare. this recipe uses simple everyday ingredients you probably already have on-hand!
2020-05,"the blue hawaiian is a fun, refreshing cocktail made with rum, cream of coconut, pineapple juice, and curacao liqueur to create its signature blue color. invented in hawaii in the 1950s, this tiki cocktail will have you crooning like elvis!"
2022-01,"this pineapple kiwi mojito is made with fresh fruit and no added sugars or other juices. it looks like a fancy cocktail, but you'll be surprised by how simple it is to prepare and enjoy on a hot summer day!"
2021-03,"hawaiian mimosas - this easy cocktail recipe has just three ingredients and will make you think you're on a beach in paradise. pineapple, rum, and champagne is all it takes to make this delicious cocktail!"
2020-04,"nothing says summer like a freshly cut slice of watermelon. this recipe from our friends at the national watermelon promotion board does the sweet fruit justice in the form of a boozy, colorful cocktail on the rocks."
2022-02,hawaiian champagne punch is an easy mimosa recipe full of pineapple and orange juice and rum! it's the perfect party punch recipe!
2019-12,"peaches are a delicious summer staple in our home, and we also love our kentucky bourbon. put the two together, and you get this amazing bourbon peach smash cocktail, one of the most refreshing bourbon drinks we've ever had!"
2020-07,the painkiller is a rich and fruity tropical drink that is a specialty of the british virgin islands. ease your pain with this vacation in a glass.
2020-09,"a fresh, summer-friendly grapefruit cocktail perfect for outdoor parties"
2019-06,pineapple rum punch - the perfect mix of tropical flavors in one amazing and easy to make party drink!
2020-04,"cherry bomb recipe, a fresh cocktail or mocktail made with fresh (or frozen) cherries muddled with bourbon, vanilla, maple syrup, lemon and club soda."
2022-04,"this limoncello gin collins is fizzy and refreshing, with a prominent lemon flavor. minty simple syrup helps to balance out the tartness of the lemon juice and limoncello."
2021-03,"honey isn’t just for your crumpets, you know."
2019-10,"a minty fresh mojito no longer seems appropriate at this time of year and yet glass after glass of mulled wine can be a bit much. this winter-spiced pear cocktail bridges that gap perfectly, it’s light but the warming spices of star anise and cinnamon and the silky texture you get from the egg white make it a great seasonal alternative"
2020-12,"prepare yourself for the weekend with a refreshing blackberry dark and stormy. light and fruity, and just boozy enough to make the perfect summer drink."
2019-07,"this whisky cherry coke smash, made with crown royal, has a rather remarkable flavor profile that must be tasted to be believed."
2018-02,"the tequila honey bee is a refreshing cocktail from nick korbee, the executive chef and beverage director at egg shop in new york city"
2021-06,"this blueberry cocktail is made with fresh blueberries, lemon juice, jam, thyme and gin that is topped off with some ginger ale."
2022-05,elevate your holiday with a sparkling purple gin cocktail! empress gin & elderflower liqueur make this champagne cocktail a party favorite.
2018-05,the paper plane-a straightforward box-step of a recipe made with precisely equal proportion of four ingredients-may be the best bourbon cocktail that ...
2022-02,summer in a cup! this refreshing grapefruit paloma cocktail is the perfect sipper for those hot sunny days.
2021-12,this blackberry whiskey sour turns a classic whiskey sour into a fun and fruity cocktail.
2020-12,rudolph’s tipsy spritzer features the perfect balance of flavors that goes beyond a simple mix of vodka and cran. this easy holiday spritzer makes a party-perfect punch that can easily be made kid-friendly.
2019-05,a magic color changing butterfly pea tea mojito cocktail to wow your friends and family with the power of food magic - and science!
2020-05,your favorite sour watermelon candies just got an adult twist in this slushy recipe from delish.com.
2021-03,three fruit juices and clear rum make this easy tropical rum punch cocktail recipe perfect! single serve and pitcher instructions.
2021-12,"a delicious mix of vodka, st. germain (elderflower liquor), and fresh squeezed winter citrus juice, topped off with bubbly ginger beer and extra festive pomegranates. simple and refreshing, serve this festive cocktail pitcher style at your christmas gathering."
2021-04,"a twist on a classic smash cocktail.  delicious tequila cocktail made with smashed blackberries and a little mint, fresh lemon, and of course anejo tequila"
2018-02,"this is such a delicious cocktail and looks hella pro, the best thing is you can make it well in advance leaving you plenty of time to lap up all the compliments from your guests."
2019-11,"bourbon, light of my life, fire of my tongue. my sin, my soul. bo-ur-bon. these refreshing recipes have stood the test of time, just like jim beam® bourbon."
2021-01,"cool down from the summer heat wave with this fresh cucumber apricot gin fizz that has fresh, juicy apricots and cooling cucumbers all muddled with a spike of botanical gin!"
2020-04,"this lime in the coconut cocktail recipe combines fresh lime juice, coconut milk and crushed ice for a refreshing summer daiquiri! the non-alcoholic version is just as good and resembles a brazilian lemonade!"
2020-12,"a lightened up skinny paloma made with freshly juiced grapefruit, tequila, lime juice and sparkling water."
2022-05,"gorgeous dragon fruit juice muddled together with mint, vanilla and lime in a fruity sparkling mojito cocktail!"
2017-01,"combining southern comfort, amaretto, sloe gin and orange juice, the alabama slammer cocktail is an old favorite that packs a boozy punch."
2020-06,a magical purple hued spanish style gin & tonic featuring empress gin.
2022-04,"sweet lychee, tangy raspberry and a topping of bubbles are the star ingredients in @cooking_with_wine's raspberry lychee spritz."
2020-04,"this strawberry-basil moscow mule is a fruity twist on the classic! mixed with vodka and spicy ginger beer, it's a perfect cocktail for a hot summer afternoon."
2021-02,"make the most of the season’s plump, ripe figs in this pretty twist on a gin and tonic. it's a beautifully tasty gin and tonic recipe!"
2020-07,"this strawberry gin and tonic is an easy, refreshing cocktail that's a fun twist on your favorite g&t!"
2022-02,"this simple bramble cocktail is made in a cocktail shaker, then poured over crushed ice for a cool and refreshing sip. the layering looks complicated, but it's so simple it's almost criminal. you'll pour black raspberry liqueur over the gin sour; since it's heavier than gin, it will naturally sink to the bottom, creating a ridiculously fancy looking cocktail with almost zero effort."
2021-01,"an earl grey old fashioned is an elevated version of the classic cocktail, with the rich and warm flavor of tea-infused bourbon. it’s made with home-made earl grey simple syrup. easy to make, silky smooth, and delicious as a summer night-cap!"
2021-12,"this delightful frosty the snowman cocktail will bring back childhood memories of the classic christmas special! loaded with peppermint flavor, it's sure to put a smile on just about anyone's face this season."
2021-07,"if you decorate your home well, you may feel like something is still missing. in your apartment, there is a lot of bare wall space, and you do not want to cover it up with tacky posters.  go with the cool cocktail tin signs , choose from 24 designs that will make any room inviting. perfect for your home kitchen bar, coffee shop, pub or any coffee corner. our signs are made out of tin so they’ll hold up much better than any flimsy poster ever will. you can add our  cocktail tin signs to any wall decor to make it unique.   the tin signs come with four pre-punched holes, so they can be mounted easily on walls or fences. no need for adhesive or special equipment! both edges and rounded corners are rolled and hemmed. it is great as wall pediments for home, kitchen, cafe, pub, restaurant, store and so on. the signs would make a great gift for friends, dads, and moms on their birthdays, holidays, new year's, and mother & father's day. specification  size: 15x30cm (5.9x11.8 inch) weight: 0.18kg (0.39lbs)  24 different designs  made from durable metal printed with two-color finish on tin, which can be displayed for many years easy to hang, equipped with four screws holes and can be installed with double tape. retro-artificial bronze and rust give it the perfect look of retro feeling."
2021-08,"everyone needs a few delicious homemade beverages up their sleeve for upcoming summer parties, and nothing is more refreshing on a hot day than one of these 25 cold, fruity, summer drink recipes. this list is packed with sweet sippers you’ll love—from classics like strawberry lemonade and strawberry smoothies, to fresh new favorites like pomegranate [...]"
2021-12,this amazing cranberry margarita is packed with sweet tart flavor and a brilliant bright red color! a delicious spin on the classic.
2022-04,this recipe for pink gin prosecco cocktails will get the party started! also be sure to check out our julep inspired empress gin dri...
2021-02,"these are the fast, easy, and refreshing tequila drinks of your dreams."
2020-05,"put a fruity summer twist on the classic moscow mule with this grapefruit moscow mule recipe! visit for hundreds of cocktail recipes, party ideas and more!"
2021-09,"get transported to southern italy with this refreshingly delicious limoncello gin martini, a cocktail that features the zesty liqueur along with gin, lemon juice and simple syrup. salute!"
2018-10,"we’re officially in apple-picking, cozy-sweater season and we’re not complaining one bit. the flavors of this season are always our favorite, so we’re combining a few for a special cocktail."
2018-09,what better way to welcome summer than with this summer citrus white sangria! this refreshing cocktail is so delicious and made with fresh ingredients!
2021-06,"this lime in the coconut cocktail recipe combines fresh lime juice, coconut milk and crushed ice for a refreshing summer daiquiri! the non-alcoholic version is just as good and resembles a brazilian lemonade!"
2020-05,"a lightened up skinny paloma made with freshly juiced grapefruit, tequila, lime juice and sparkling water."
2021-08,"prosecco margarita, a big-batch recipe perfect for entertaining and celebrating! if you've ever wondered how to make a pitcher of margaritas, this sparkling drink is super fun and delicious!"
2022-01,"if you love pina coladas, you're going to love this sparkling pina colada rum punch.  this delicious cocktail combines sparkling wine with pineapple juice and coconut rum making it the perfect summer cocktail!"
2018-10,"zingy and refreshing, this watermelon mint moscow mule is sure to cool you off in the summer heat! so easy to make at home with fresh ingredients."
2022-04,this key lime cocktail with coconut rum and fresh key limes is a delicious summer slushie for the grown-ups! this will cool you off all summer long.
2021-10,"if you love mango and mezcal, this is the perfect margarita recipe for you! all you need is five minutes and a few simple ingredients that should be easy to find at the grocery store. if you make this margarita, make sure to tag us on instagram stories @mexicoinymypocket and #mexicoinmypocket !"
2021-12,this blackberry champagne mule takes just seven simple ingredients to make. the fresh blueberries and mint sprig make this extra special.
2020-06,looking for a cocktail recipe? try this delicious and refreshing tequila based mexican cocktail called the paloma cocktail. view the recipe here at drizzle and dip.
2021-08,"this limoncello gin collins is fizzy and refreshing, with a prominent lemon flavor. minty simple syrup helps to balance out the tartness of the lemon juice and limoncello."
2019-09,make this limited ingredient summer cocktail with pineapple juice and a couple other ingredients. it's the perfect summer cocktail and tastes delicious.
2019-04,"can you believe there are only a few weeks of summer left? that means now is the time to squeeze in as many of your favorite summer activities before fall is officially here. i still have a pretty long list of things that i want to do this summer, but to be honest i just want to eat as many peaches"
2020-04,"bikini martini is the perfect drink to sip poolside. vodka, coconut rum, lemonade, fresh pineapple juice, and grenadine make a tropical sweet treat. serve up- or my style- on the rocks! #nationalmartiniday #bikinimartini #summerdrinks"
2022-05,"this floral sangria recipe is made with white wine and elderflower liqueur. it’s refreshing, light, fruity with the most beautiful floral notes throughout. it’s refreshing and perfect for spring."
2022-05,love a delicious 3 ingredient drink recipe? this creamy root beer rum cocktail tastes like an adult version of a root beer float.
2019-05,"this 5-ingredient lavender lemonade cocktail is a fun twist on the classic lemonade. all you need to do is whip up some lemon peel lemonade, make an easy lavender simple syrup, and splash in some vodka. take your lemonade game to the next level with this sweet and zesty sip of summer!"
2017-02,this raspberry vodka mojito recipe is lightly sweet and very refreshing!
2021-07,"summer rosé sangria from barefoot contessa. combine the rosé, pomegranate juice, lemon juice, sugar, grand marnier, cognac, 1 cup of water, and 1 cup of ice in a large glass pitcher. stir in the raspberries, strawberries, and plums, cover, and refrigerate for at least 2 hours but preferably…"
2020-12,"summer cocktails! here's a drink that will make you feel like you're on vacation without the hit to your wallet. the tart grapefruit paired with chilling cucumber should probably come with a pair of sunglasses,"
2020-09,"our limoncello cocktaill keeps it sweet and simple: just three ingredients are all you need to create this pucker-worthy refreshment. to make things even easier, this light and lemony cocktail recipe is perfectly portioned to top off two champagne flutes, making it the just right for toasting your togetherness."
2021-05,winter wonderland and halloween in a glass! a perfect all seasons mimosa-sip on this delicious frosted winter prosecco cocktail
2020-03,"a light and lovely warm weather cocktails, this raspberry , limoncello, and prosecco cooler is delicious!"
2021-04,"a lightened up skinny paloma made with freshly juiced grapefruit, tequila, lime juice and sparkling water."
2022-01,these watermelon & cucumber mojitos are going to become your next refreshing go-to summer drink - serve them in an ice cold pitcher!
2022-04,"strawberry lemonade vodka slush is a fruity, refreshing frozen cocktail. sweet strawberries, lemonade, and vodka, make a perfect boozy summer drink!"
2019-03,a festive margarita for christmas with cranberry and pomegranate.
2020-06,"vodka, pineapple juice, spicy ginger beer and lime juice come together in this refreshing tropical variation of the classic mule cocktail!"
2021-08,"this easy moscato sangria is filled with fresh strawberries, peaches, citrus, orange liquor and mint for one epic refreshing sip! a sweet and crisp sangria recipe that's the perfect cocktail to serve all summer long!"
2019-04,this is a refreshing summer drink with lively and sweet italian cantaloupe melons and the right twist of silver tequila and lime!
2021-07,"whether using st. germain, another elderflower liqueur, or a homemade cordial, explore fascinating elderflower cocktail recipes to mix up at home."
2020-03,"looking for a light, refreshing cocktail that's perfect for summer sipping? this raspberry mojito cocktail totally fits the bill! loads of raspberry flavor, with hints of mint and lime. perfect for you next patio get together."
2019-10,"frozen peach bellini cocktail – light, refreshing and super easy to make! this elegant cocktail slush will be a hit for any summer party. all you need is 3 ingredients and 5 minutes – s…"
2022-01,this moscow mule is the perfect fall cocktail that puts a unique twist on the traditional moscow mule by adding fresh apple cider.
2022-05,this lava flow drink is a cross between a piña colada and a strawberry daiquiri. the perfect colorful tropical frozen cocktail to make you dream of white sandy beaches and clear blue water.
2021-12,"this bee’s knees cocktail recipe is a timeless favorite! crisp gin is softened by smooth honey, shaken to perfection. keep reading to get the easy recipe and add this cocktail drink idea to your cocktail shaking repertoire. cheers! why is it called the bee's knees? it’s all about the honey, friend! the bee’s knees is a classic prohibition cocktail. even the name evokes the era. ""bathtub gin"" was found in many speakeasies. it was really quite bitter honey was added to sweeten and lemon adds th..."
2022-04,put a cherry kick in your vodka cocktail.
2022-05,"are you looking for a fun summer drink that reminds you of the beach? then this ocean breeze cocktail recipe is exactly what you are looking for it. it is fun and refreshing on these hot summer days. the perfect summer drink. all you will need is 7-up, blue curacao liqueur, and coconut rum. we …"
2021-02,"if you're looking for a romantic cocktail, look no further! it doesn't get more romantic than this unique and delicious, rose water gin cocktail!"
2022-04,"a salted butterscotch white russian is a tasty fall cocktail using butterscotch schnapps and coffee liqueur. for me, a kahlúa white russian is the best autumn cocktail!"
2018-06,"this jalapeno watermelon margarita is your new favorite margarita. the perfect balance of sweet and spicy and made with fresh pureed watermelon and spiked with jalapenos and just a splash of tequila, lime juice and orange liqueur. this is the spicy cocktail of your dreams."
2020-11,"""a thing of austere beauty: a lump of sugar, dissolved with a little water and two dashes of bitters, whiskey, a bit of ice and a lemon peel garnish.”"
2019-06,a refreshing watermelon punch made with tequila! it's perfect for an outdoor summer party.
2021-06,this delicious two-ingredient cocktail is sure to win your heart! garnish with a lemon wheel and rose petals for an elevated look.
2018-08,"coconut rosewater blackberry smash. need i say more? this simple spring recipe is perfect for porch sipping, party throwing, shower hosting, or any old day that calls for a drink as beautiful as it is delicious. what do you do when the calendar (and, god-willing, the weather) heralds the beginning of spring, but no seasonal...read more »"
2022-02,"the venetian sunrise is deceptively complex, combining tropical flavors with bright, bracing notes from italian amaro. fresh vanilla and pineapple juice are layered on a rum base to make you feel like you’re sitting on a beach in the caribbean. a kiss of aperol and orange bitters brings italy into the mix and adds complexity to the otherwise light drink, while rosé simple syrup keeps the drink from getting lopsided. a few bold, definable flavors, one radiant cocktail."
2020-08,"this refreshing watermelon vodka soda is the perfect summer cocktail! fruity, perfectly sweet, and easy to make!"
2020-09,"tis the season for fresh berries, and adding them to cocktails is the perfect way to enjoy them! grab your favorite bourbon and some berries, and make this amazing blackberry bourbon smash cocktail...you'll thank me later!"
2021-01,this raspberry lime vodka cocktail is so refreshing and super easy to make. all the raspberry fans are guaranteed to fall in love with the raspberry infusion. the cocktail requires only a few ingredients and doesn't contain a lot of alcohol at all. perfect for lightweight drinkers and any get-together or a friday or date night in!
2021-11,"bursting with flavors of the season, and tequila, these white christmas margaritas, made with white cranberry juice and ginger beer, are going to be your new favorite holiday cocktail."
2022-04,"tangy pineapple shaken with sweet coconut milk makes a summery twist on a classic cocktail. perfect for poolside sipping, this pineapple coconut margarita is the best of both a pina colada and a margarita with only one hand needed."
2019-09,"lightly sweetened, this flavorful margarita is a thai-inspired take on the classic tequila cocktail. flavored with fresh ginger, lemongrass and cilantro (or thai basil), this marg is easy to make and fun to serve!"
2019-07,a frozen peach bellini recipe blended with frozen peaches and peach liqueur then topped with sweet raspberry liqueur and a little tart red wine.  it's the perfect summertime adult slush!
2022-04,"summer produce used simply. this gin basil smash is a fresh, clean drink with the aroma of fresh basil and sweet raspberries. muddle, shake, drink. ﻿"
2020-03,"cool off with a frozen mermaid rum punch. an ocean blue tropical drink recipe with lemonade, coconut, white rum, banana and blue curacao that’s absolute magic!"
2022-01,"this japanese inspired cocktail is energetic and full of sweet and citrus flavors! it features sake, vodka, yuzu juice, soda water, peach syrup, and butterfly pea flower tea!"
2019-07,"fun, fruity, refreshing, delicious....this strawberry mojito has it all."
2021-11,"spicy pineapple mint margaritas combines freshly muddled pineapple chunks with mint and jalapeños shaken up with a mint syrup, tequila, and a touch of orange liquor. the perfect cocktail to sip on for a refreshing tropical twist."
2021-12,a festive margarita for christmas with white cranberry  juice.
2019-05,"the rhubarb paloma is a tart and refreshing tequila cocktail paired with citrus and rhubarb simple syrup, served over ice. cheers!"
2019-04,"photo by @rachelgurjar my dad is not like the other dads, he’s a cool dad! and you know what cool dads do? make frozen margaritas, that’s what. ever since i’ve been of the drinking age (of course…), my dad’s go-to house cocktail is a good ol’ frozen marg. any guest knows that they can expect a blended tequila drink if they’re coming to our house. what can i say? he’s a tequila-loving dude that can get down with a frozen cocktail–i am definitely my father’s daughter. apple (or passionfruit?) doesn’t fall far, you could say. because he is also a man that loves a discount, he does a majority of his grocery shopping in the aisles of costco. one of his staples is an enormous bag of frozen mango (if you haven’t gotten your hands on one of these guys, i’d highly recommend it). he’s been blending margaritas for a long time now, but it wasn’t until recently that he had the epiphany to toss in a couple cubes of frozen mango to the party. the result? absolute mango madness! frozen mango has the most luscious, silky smooth texture that lends itself beautifully to frozen cocktails. given that my ultimate goal in this life of sin is to one up my dad in every possible way, i wanted to develop an epic frozen margarita that is ever-so-slightly more delicious than his classic frozen mango margs. guess what? i did! dad, you can pack your knives and go. jk, but you can go to costco and buy these ingredients for me.  the key addition to my next level margs? passionfruit! a couple weeks ago in the feedfeedbrooklyn test kitchen, we had a variety of tropical fruits on set for a shoot, and i was reminded just how delicious fresh passion fruit tastes. it’s the perfect balance of tart, sweet, and fruity–i’m salivating just thinking about it. what better way to use such a unique, mouthwatering flavor than in a frozen cocktail? not to mention, the salty spice from the tajin rim cuts the sweetness of the margaritas, making them the ultimate, lip-puckering cocktail. watch out dad, you’ve got some serious competition!"
2022-05,an easy and refreshing watermelon cucumber lemonade drink recipe that will cool you down on those hot summer days. this recipe is less than 10 ingredients and only 5 steps and has a refined sugar-free option.
